{
  "category": "medical-risk",
  "priority": "P1",
  "route_to": "escalation",
  "risk_flags": [
    {
      "type": "medical",
      "severity": "high",
      "description": "P1 medical case"
    }
  ],
  "human_review_required": true,
  "suggested_initial_response": "",
  "internal_notes": "Baseline output for CS-ESC-003"
}